{
  "object_type": "verification_receipt",
  "schema_version": "v2",
  "bundle_id": "bundle-001",
  "asset_type": "property",
  "verification_mode": "offline",
  "verified_at": "2026-05-08T00:00:00Z",
  "policy_id": "loquitur.policy.property.demo",
  "policy_version": 1,
  "status": "pass",
  "reason_codes": [
    "INTEGRITY_OK"
  ],
  "manifest_sha256": "sha256:aaaaaaaaaaaaaaaaaaaaaaaaaaaaaaaaaaaaaaaaaaaaaaaaaaaaaaaaaaaaaaaa",
  "reason_code_vocabulary_version": "loquitur.reason_codes.v1"
}
